Coprinus / comatus#978-86-912677-0-4#http://www.mushroomexpert.com#edible#meadow / /#ground#Šešir do 20 cm, jajast pa zvonolik, u nijansama bele boje, prekriven beličastim do oker ljuspama, u samom vrhu je gladak u nijansam oker boje. Listići su veoma gusti, slobodni, beli, ružičasti pa crni i potpuno delikvesciraju. Drška je do 35 cm, beličasta, u donjem delu se nalazi tanak, beličast prsten.#Cap up to 20 cm, oval than bell-like, in shades of white, covered with whitish to ocher flakes, at the top is smooth in shades of ocher. Gills are very dense, free, white, then pink and black, so completely dissolve. Stem is up to 35 cm, whitish, at the lower part is thin, whitish ring.#Spore su veličine 9-13 x 7-9 µm, eliptične, glatke, sa centralnom do blago ecentričnom porom. Bazidije su sa 4 spore.#Spore sizes 9-13 x 7-9 mm, elliptical, smooth, with central to slightly eccentric pore. Basidia with four spores.#Tanko, beličasto, pa ružičasto, na kraju pocrni.#Thin, whitish, and pink, eventually turns black.###Potencijalno je otrovna, ako se konzumira sa alkoholom izaziva koprinski sindrom trovanja.#Potentially poisonous, if consumed with alcohol causes coprine poisoning syndrome.
Amanita / rubescens#978-86-912677-0-4#http://www.mushroomexpert.com#edible#forest / deciduous /  ; forest / coniferous / #litter ; ground#Šešir do 20 cm, zaobljen pa raširen, blede oker do braonkastooker boje, pokriven krpastim ostacim opšteg vela. Listići gusti beli, na oštećenim mestima roze. Drška do 20 cm, sa bulbom u osnovi, iznad nje se nekad nalaze koncentrične šare, beličasta do braonkasta bez ostatka volve. Prsten beličast i viseći.#Cap up to 20 cm, rounded and spread, pale ocher to brown-ocher colored, covered with the remains of lobed general veil. Gills thick white, pink in damaged places. Stem up to 20 cm, with bulb in the base, above it sometimes are concentric patterns, whitish to brownish without volve residue. Whitish ring and hanging.#Spore su glatke, elipsoidne,  6.5-10.5 x 5-7 µm. Bazidije su sa 4 spore.#Spores are smooth, ellipsoidal, 6.5-10.5 x 5-7 µm. Basidia has four spores.#Beličasto, na oštećenim mestima roze boje. Bez posebnog mirisa i ukusa.#Whitish, pink in damaged places. No special smell or taste.##Površina šešira sa KOH deluje negativno.#KOH with cap surface has negative effect.#
Agaricus / sylvaticus#978-86-912677-0-4#http://www.rogersmushrooms.com#edible#forest / coniferous /#litter ; ground#Šešir do 10 cm, tanak, zaobljen pa raširen,u nijansama braon boje, na kraju puca na ljuspice na svetloj osnovi. Listići su gusti, sivkastoružičasti pa braon boje, sterilna ivica je svetlija. Drška je do 10 cm, sa bulbom u osnovi, beličasta, crveni na oštećenim mestima. Prsten tanak i beličast.#Cap up to 10 cm, slim, rounded and spread, in shades of brown, at the end of the has scales on light cap surface. Gills are dense, grayish-pink than brown, sterile edge is brighter. Stem is up to 10 cm, with bulb in the base, whitish, red on damaged places. Ring thin and whitish.#Spore su ovoidne, sitne, 4.5–6 x 3–3.5 µm, u masi braon boje. Heilocistidije su široko batinaste.#Spores are ovoid, small, 4.5-6 x 3-3.5 mm, brown in mass. Cheilocystidia are widely stick.#Beličasto, na preseku narandžasto crveno, kasnije krvavo crveno. Prijatnog mirisa i ukusa.#Whitish, at section orange-red, then blood red later. Pleasant smell and taste.####
Paxillus / involutus#978-86-912677-0-4#http://www.mushroomexpert.com#poisonous#forest / / ; anthropogenic / /#ground#Šešir do 15 cm, zaobljen pa raširen, na kraju udubljen, somotast po vlažnom vremenu sluzav, u nijansama oker, maslinaste i braon boje, podvijenih ivica. Listići su gusti, silazni, prema dršci anostomoziraju, oker boje na dodir tamne u crvenim i smeđim nijansama. Drška je do 8 cm, ekscentrična i u boji šešira a prema osnovi tamnija.#Cap up to 15 cm, rounded and spread, eventually depressed, velvety and under wet weather mucous, in shades of ocher, olive and brown, with curved edges. Gills are dense, downward, toward the handle they merge, ocher color, on touch they dark in red and brown tones. Stem is up to 8 cm, eccentric, in color of cap and darker towards the base.#Spore su eliptične, glatke, 6.5-10 x 5-7 µm veličine. Pleiocistidije i heilocistidije su manje-više fuzoidne.#Spores are elliptical, smooth, 6.5-10 x 5-7 µm in size. Pleiocystidia and cheilocystidia are more or less fuzoid.#Žućkasto, debelo i čvrsto, na oštećenim mestima potamni. Gljivljeg mirisa i nakiselog ukusa.#Yellowish, thick and tight, in damaged places darkens. Fungal odor and sour taste.#Površina šešira pri reakciji sa KOH menja boju u sivu.#Cap surface in reaction with KOH changes color in gray.#Smrtno otrovna.#Deadly poisonous.
Ascocoryne / sarcoides##http://www.naturefg.com##forest / deciduous /#lying_trunk ; stump ; branches #Apotecije pihtijaste, mlade loptaste, zatim blago spljoštene i blago ulegnute, zrele obkonično-čigraste, 3-30 mm u prečniku, ivica često nepravilno valovita, ponekad malo tamnija, nikad ne prijanja na podlogu. Himenofor gladak ili blago naboran kad je zreo, roze do ljubičasto-roze. Spoljašnja strana beličasta, fino dlakava. Drška ± jasno vidljiva##Askusi sa 8 spora, uniserijatni ili biserijatni, amiloidni. Parafize cilindrične, septatne, razgranate, na vrhu blago do srednje (ponekad i jako) glavičaste, dok su mlade ispunjene su sa puno sitnih uljanih kapi a kasnije sa nekoiko većih. Spore elipsoidne, glatke, hijaline, sa 2 (-4) simetrično raspoređene velike uljanekapi i puno sitnih, najčešće sa jednom septom u sredini (ponekad bez septi ili sa 2-3 septe), 12-21 x 4,5-5,2 µm. Nakon klijanja spora, konidije ostaju spojene formirajući lance na njenim krajevima#######
Morchella / esculenta##http://www.naturefg.com#edible#forest / / ; forest / freshwater_swamp / ; meadow / /#ground#Plodno telo 3-20 (30) cm, nepravilno sferično do ovalno, pomalo konično, sa zaobljenim do poligonalnim, dubokim alveolama, rebra vijugava. Šešir visine 1/2 do 2/3 dužine drške, sivo braon, oker-žut do medno-žut. Drška bela do oker, dlakava, naborana, šuplja, u donjem delu stisnuta.##Askusi sa 8 spora, 300-380 x 17-22 μm. Parafize septatne, razgranate, proširene u gornjem delu do 20 μm. Spore široko eliptične, glatke, hijaline, ponekad sa malim uljanim kapima na krajevima (van zida spore), 18-23 x 11-14 μm.##Meso elastično, blagog ukusa#####
Verpa / bohemica##http://www.naturefg.com#edible#forest / / ; forest / freshwater_swamp /#ground#Plodno telo 4-15 cm visine. Šešir zvonast do cilindričan, visine 2-5 cm, nepravilno narebran, rebra vijugava, ± vertikalna i snažno istaknuta, svetlo do tamno braon, unutrašnja površina beličasta. Drška 4-15 x 1-3 cm, oker, dok je mlada čvrsta a zatim postaje šuplja, spojena sa šeširom samo pri vrhu.##Askusi sa 2 spore, 250-350 x 18-25 μm. Parafize cilindrične, blago talasaste, septatne, 5-8 μm. Spore cilindrične, glatke, hijaline, ponekad blago zakrivljene, 55-87 x 17-20 (22) μm.##Meso krto, blagog ukusa.#####
Helvella / crispa##http://www.naturefg.com##forest / mixed / ; anthropogenic / park /#ground#Plodna tela visine do 15 cm, kapica prečnika 3-6 cm, sedlasta do nepravilno režnjevita, ivica nije srasla sa drškom, često savijena na gore. Himenijum beličast, kremast do oker, gladak ili malo naboran. Spoljašnja strana fino dlakava, iste boje kao himenijum ili malo tamnija. Drška 3-10 cm duga i 0,5-4 cm široka, bela ili blago ružičasta, zatim žućkasta, sa dubokim anastomozirnim rebrima koji grade jamice različite dubine.##Askusi sa 8 spora, 250-300 x 14-18 μm, cilindrični, uniserijatni. Parafize cilindrične, na vrhu glavičasto proširene (-9 μm), septatne. Spore široko eliptične, glatke (dok su mlade sa zaobljenim bradavicama), hijaline, sa 1 krupnom uljanom kapi, 17 - 20 х ( 9 ) 10 - 12 μм.#######
Sarcoscypha / coccinea##http://www.naturefg.com##forest / / #buried_wood#Apotecije peharaste, naborane i udubljene, prečnika 10-40(-80) mm, ivica valovita, često erodirana i iscepkana. Himenijum gladak, crven (vremenom bledi), go ili fino dlakav; spoljašnja strana beličasta (ili crvenkasta što potiče od boje gornje površine), glatka ili fino dlakava, naborana. Drška nedostaje ili je rudimentirana, iste boje kao spoljašnja strana.##Askusi sa 8 spora, uniserijatni, 300 x 12 µm. Parafize končaste, širine 2-3 µm, ponekad blago proširene na vrhu a u srednjem delu nisu proširene nikada, ispunjene sitnim uljanim kapima narandžasto-crvene boje zbog karotenoida. Ekscipularne dlake uglavnom ravne i samo malo vijugave. Spore elipsoidne, (24.5-)27-35-43(-51) x (10-)11-14(-14.5) µm, zrele uvek bez sluzavog plašta, sa nekoliko malih uljanih kapi (1-3 µm) na svakom kraju, veoma malo skraćene na krajevima (najbolje se vidi na mrtvom materijalu), krajevi nikad nisu uvučeni. Konidije se formiraju samo na micelijumu, nikada na askosporama, 4-5.5(-6.5) x 2.2-2.6 µm, sadrže dve velike uljane kapi na polovima i nekoliko malih.#######
Bisporella / citrina##http://www.naturefg.com##forest / deciduous /#lying_trunk ; stump ; branches #Apotecije prečnika 1-3mm, peharaste ili ispupčene; himenijum gladak, jarko žute, starenjem (i osušene) postaju narandžasto žute, često sa tamnijim ivicama; spoljašna strana glatka, bezbojna, svetlija od himenofora. Drška nedostaje ili je veoma kratka.##Askusi cilindrični, 100-135 x 7-8 µm; sa 8 spora, neredovno biserijatni. Parafize filiformne, prečnika do 1,5 µm, neznatno glavičaste na vrhu, sa krupnim žutim uljanim kapima. Spore elipsoidne, sa jednom septom, bez ili sa 1-2 uljane kapi na svakom kraju, 9-14 x 3-5 µm.#######
Bulgaria / inquinans##http://www.naturefg.com##forest / deciduous / carpinus, fagus##Apotecija u početku ima oblik crnog diska sa braonkastom savijenom ivicom a kasnije postaje zdelasta pa zatim spljoštena ili konveksna; prečnika 1-5 cm; spolja je braon do crne boje, fino dlakava ili krljušasta (starenjem često postaje glatka i tamnija) a sa gornje himenijumske strane crna, sjajna i glatka##Spore 9-17 x 6-7 µm, eliptične do pomalo limunaste; glatke; askusi 150-200 µm dugi sa 8 spora; gornje 4 spore unigutulatne (u KOH), a donje 4 spore slabije razvijene, multigutulatne, hijaline; parafize filiformne.##Meso je gumenasto do pihtijasto#####
Diatrype / disciformis##http://www.naturefg.com##forest / deciduous / fagus #branches#Peritecije prečnika 0,2-0,4 mm, crne, poređane u jedan ili dva sloja u površinskoj braon-crnoj stromi. Stroma jastučasta, okruglasta i spljoštena odozgo, izlazi iz kore drveta, po površini nešto gruba i ± izrazito prošarana ostiolama peritecija.##Askusi sa 8 spora, nepravilno biserijatni, 30-40 x 5 µm, sa apikalnim prstenom. Parafiza nema. Spore alantoidne, glatke, blago braonkate, 7-9 x 1,5-2 µm.#######
Xylaria / longipes##http://www.naturefg.com##forest / deciduous / quercus, fagus, carpinus, acer#buried_wood ; branches#Plodna tela podeljena u sterilnu dršku i fertilnu glavu. Glava je cilindrična, često savijena, crna, gruba i bradavičava sa ostiolama peritecija, ponekad podeljana u polja kao mreža finih pukotina, 30-60 (80) x 3-8 (10) mm. Drška cilindrična, braon-crna, gore glatka, prema dole dlakava i donekle zadebljala, postepeno spojena sa glavom, 10-30 x 2-5 mm.##Askusi sa 8 spora, uniserijatni, 130-140 x 6-7 µm, sa apikalnim prstenom. Parafize končaste. Spore eliptične, spljoštene na jednoj strani, glatke, tamno braon, 13-16 x 5,5-7,5 µm; sa 1-2 uljane kapi i vidljivim germinativnim prorezom.#######
Nectria / cinnabarina##http://www.naturefg.com##forest / deciduous /#branches#Peritecije prečnika 0,2-0,4 mm, okruglaste do ovalne sa jasnom papilom, grube površine, svetlo crvene do braon-crvene. Veći broj plodnih tela zajedno nalaze se na jastučastoj, nešto svetlije obojenoj, stromi koja izlazi iz kore drveta. Aseksualni stadijum se naziva Tubercularia vulgaris i znatno se češće uočava u prirodi. U ovoj konidijalnoj fazi imaju jastučast izgled i svetlo su narandžaste do roze boje.##Askusi sa 8 spora, nepravilno biserijatni, 75-90 x 9,5-12 µm. Spore cilindrično-eliptične, glatke, hijaline, sa jednom septom po sredini i na tom mestu malo sužene, (12) 16-19 (25) x (4) 5,6-6 (9) µm.#######